id,version,"created_at","updated_at",user_id,description_id,rss_log_id,num_views,"last_view",north,south,west,east,high,low,ok_for_export,"notes","name","scientific_name",locked
4965,4,"2012-04-11 16:35:51","2014-04-15 22:48:18",911,NULL,100727,31,"2018-02-02 16:22:55",36.9689,36.9687,-122.038,-122.037,NULL,NULL,1,"

[admin - 2014-04-15 22:48:18 +0000]: Merged with Multidisciplinary Association for Psychedelic Studies, Santa Cruz, California, USA: North: 37.0003, South: 36.9374, West: -122.099, East: -121.976","Multidisciplinary Association for Psychedelic Studies Offices, Santa Cruz, California, USA","USA, California, Santa Cruz, Multidisciplinary Association for Psychedelic Studies Offices",0
4973,2,"2012-04-13 12:17:54","2017-01-14 01:29:06",123,NULL,100922,77,"2018-08-07 17:50:26",37.8616,37.8473,-122.206,-122.188,NULL,NULL,1,"","Robert Sibley Volcanic Regional Preserve, Oakland, California, USA","USA, California, Oakland, Robert Sibley Volcanic Regional Preserve",0
4978,1,"2012-04-14 02:04:33","2012-04-14 02:04:33",911,NULL,100992,8,"2018-01-12 20:58:23",36.9785,36.9778,-121.91,-121.909,NULL,NULL,1,"","Landscaping Island, State Park Drive, Aptos, Santa Cruz Co., California, USA","USA, California, Santa Cruz Co., Aptos, State Park Drive, Landscaping Island",0
4991,2,"2012-04-18 07:56:56","2017-01-03 00:10:17",986,NULL,101232,48,"2017-12-19 06:48:15",37.8364,37.8319,-122.548,-122.54,NULL,NULL,1,"","Coastal Trail, Marin Headlands, Golden Gate National Recreation Area, Marin Co., California, USA","USA, California, Marin Co., Golden Gate National Recreation Area, Marin Headlands, Coastal Trail",0
5002,1,"2012-04-21 03:56:51","2012-04-21 03:56:51",911,NULL,101489,42,"2017-09-11 20:10:20",37.3798,37.3515,-122.4,-122.372,NULL,NULL,1,"","Tunitas Creek Rd., San Mateo Co., California, USA","USA, California, San Mateo Co., Tunitas Creek Rd.",0
5003,1,"2012-04-21 04:51:03","2012-04-21 04:51:03",911,NULL,101496,22,"2017-12-16 16:22:38",36.9592,36.9521,-122.062,-122.029,NULL,NULL,1,"","Delaware Ave., Santa Cruz, California, USA","USA, California, Santa Cruz, Delaware Ave.",0
5004,1,"2012-04-21 04:56:00","2012-04-21 04:56:00",911,NULL,101498,14,"2017-11-30 14:13:02",36.9879,36.9602,-122.155,-122.071,NULL,NULL,1,"","Coast Rd., Santa Cruz, California, USA","USA, California, Santa Cruz, Coast Rd.",0
5038,2,"2012-04-27 07:15:52","2013-11-10 13:05:41",986,NULL,101903,26,"2018-04-01 09:07:22",37.9085,37.8931,-122.272,-122.263,NULL,NULL,1,"

[admin - 2013-11-10 13:05:41 +0000]: Merged with Euclid Ave., Berkeley, California: North: 37.902, South: 37.8751, West: -122.268, East: -122.26","Euclid Ave., Berkeley, California, USA","USA, California, Berkeley, Euclid Ave.",0
5110,1,"2012-05-07 15:54:21","2012-05-07 15:54:21",911,NULL,102770,135,"2018-08-17 18:14:13",36.9976,36.9826,-122.059,-122.054,NULL,NULL,1,"","Jordan Gulch, UCSC, Santa Cruz, California, USA","USA, California, Santa Cruz, UCSC, Jordan Gulch",0
5112,2,"2012-05-08 06:26:35","2012-06-26 17:06:47",986,NULL,102844,34,"2017-09-16 04:24:14",37.9065,37.8623,-122.254,-122.192,NULL,NULL,1,"","Vollmer Peak Trail, Tilden Regional Park, Contra Costa Co., California, USA","USA, California, Contra Costa Co., Tilden Regional Park, Vollmer Peak Trail",0
5588,2,"2012-07-08 15:56:48","2013-11-25 13:12:40",911,NULL,109308,44,"2018-07-20 15:44:34",36.985,36.9808,-122.065,-122.057,NULL,NULL,1,"

[admin - 2013-11-25 13:12:40 +0000]: Merged with Arboretum, University of California Santa Cruz, Santa Cruz Co., California, USA: North: 36.9855, South: 36.9813, West: -122.065, East: -122.058","UCSC Arboretum, Santa Cruz, California, USA","USA, California, Santa Cruz, UCSC Arboretum",0
5914,1,"2012-08-17 01:06:29","2012-08-17 01:06:29",4203,NULL,115247,26,"2017-12-02 05:10:21",37.7979,37.797,-122.4,-122.398,NULL,NULL,1,"","Front st @ Jackson st, San Francisco, California, USA","USA, California, San Francisco, Front st @ Jackson st",0
5944,1,"2012-08-22 15:46:09","2012-08-22 15:46:09",911,NULL,116144,13,"2017-05-10 08:13:39",36.9789,36.9598,-122.06,-122.056,NULL,NULL,1,"","Western Dr., Santa Cruz, California, USA","USA, California, Santa Cruz, Western Dr.",0
6036,1,"2012-09-03 01:35:40","2012-09-03 01:35:40",3950,NULL,118070,5,"2017-09-11 16:28:12",37.3852,37.2891,-122.028,-121.952,NULL,NULL,1,"","W. Santa Clara, Santa Clara, California, USA","USA, California, Santa Clara, W. Santa Clara",0
6068,1,"2012-09-10 16:18:56","2012-09-10 16:18:56",252,NULL,119161,27,"2018-06-03 00:35:02",37.9821,37.9251,-122.105,-122.05,NULL,NULL,1,"","Pleasant Hill, California, USA","USA, California, Pleasant Hill",0
6069,1,"2012-09-10 16:19:11","2012-09-10 16:19:11",252,NULL,119162,86,"2018-06-13 21:36:21",37.9692,37.9613,-122.091,-122.08,NULL,NULL,1,"","Paso Nogales Park, Pleasant Hill, California, USA","USA, California, Pleasant Hill, Paso Nogales Park",0
6074,1,"2012-09-11 16:54:36","2012-09-11 16:54:36",3950,NULL,119264,11,"2017-09-11 20:13:55",37.3254,37.3111,-122.405,-122.392,NULL,NULL,1,"","San Gregorio State Beach, San Mateo Co., California, USA","USA, California, San Mateo Co., San Gregorio State Beach",0
6075,1,"2012-09-11 17:19:21","2012-09-11 17:19:21",3950,NULL,119265,34,"2018-07-30 20:53:49",38.208,37.2653,-122.607,-121.77,NULL,NULL,1,"","SF Bay Area","SF Bay Area",0
6261,1,"2012-10-05 16:24:54","2012-10-05 16:24:54",564,NULL,122647,19,"2017-08-31 16:25:55",36.7765,36.7517,-121.767,-121.742,NULL,NULL,1,"","Castroville, California, USA","USA, California, Castroville",0
6262,1,"2012-10-05 16:38:15","2012-10-05 16:38:15",564,NULL,122649,21,"2017-09-06 15:44:33",36.8169,36.7902,-121.793,-121.783,NULL,NULL,1,"","Moss Landing, California, USA","USA, California, Moss Landing",0
6266,1,"2012-10-06 01:40:17","2012-10-06 01:40:17",3950,NULL,122698,26,"2017-09-13 10:09:10",37.1064,37.0625,-121.64,-121.581,NULL,NULL,1,"","San Martin, California, USA","USA, California, San Martin",0
6391,1,"2012-10-29 02:22:36","2012-10-29 02:22:36",9,NULL,125387,4,"2017-11-12 21:29:07",37.9429,37.9384,-122.53,-122.528,NULL,NULL,1,"","Piper Park, Larkspur, California, USA","USA, California, Larkspur, Piper Park",0
6577,1,"2012-11-19 19:08:05","2012-11-19 19:08:05",3813,NULL,128108,9,"2018-01-24 17:16:44",37.4921,37.4879,-122.324,-122.318,NULL,NULL,1,"","Canada Rd., Woodside, California, USA","USA, California, Woodside, Canada Rd.",0
6580,2,"2012-11-20 01:27:42","2013-11-14 01:34:57",1926,NULL,128160,8,"2017-08-30 23:04:43",36.9788,36.9736,-122.001,-121.997,NULL,NULL,1,"","Harbor Park, Santa Cruz, California, USA","USA, California, Santa Cruz, Harbor Park",0
6581,1,"2012-11-20 01:35:57","2012-11-20 01:35:57",1926,NULL,128164,36,"2017-09-05 21:07:56",36.9694,36.9667,-121.995,-121.99,NULL,NULL,1,"","twin lakes state beach area, santa cruz, California, USA","USA, California, santa cruz, twin lakes state beach area",0
6587,1,"2012-11-20 23:29:39","2012-11-20 23:29:39",4261,NULL,128309,395,"2018-08-28 14:59:39",37.884,37.8629,-122.283,-122.247,NULL,NULL,1,"","209 Genetics and Plant Biology Teaching, Berkeley, California, USA","USA, California, Berkeley, 209 Genetics and Plant Biology Teaching",0
6608,1,"2012-11-23 08:44:22","2012-11-23 08:44:22",986,NULL,128593,45,"2018-01-25 20:51:15",37.9438,37.9178,-122.308,-122.267,NULL,NULL,1,"","East Bay Hills, Richmond, California, USA","USA, California, Richmond, East Bay Hills",0
6631,1,"2012-11-26 18:12:20","2012-11-26 18:12:20",4557,NULL,128951,33,"2017-10-05 05:23:29",37.3594,37.3507,-122.176,-122.136,NULL,NULL,1,"","Moody Rd., Los Altos Hills, California, USA","USA, California, Los Altos Hills, Moody Rd.",0
6632,1,"2012-11-27 02:18:13","2012-11-27 02:18:13",986,NULL,129007,63,"2018-06-18 01:52:11",37.9214,37.8954,-122.28,-122.239,NULL,NULL,1,"","East Bay Hills, Berkeley, California, USA","USA, California, Berkeley, East Bay Hills",0
6634,1,"2012-11-27 04:55:35","2012-11-27 04:55:35",4485,NULL,129038,22,"2017-09-10 20:34:39",37.9016,37.9007,-122.271,-122.27,NULL,NULL,1,"","Dorothy Bolte Park, Berkeley, Alameda Co., California, USA","USA, California, Alameda Co., Berkeley, Dorothy Bolte Park",0
6635,1,"2012-11-27 05:10:36","2012-11-27 05:10:36",4485,NULL,129044,157,"2018-02-19 13:35:18",37.8835,37.8623,-122.266,-122.23,NULL,NULL,1,"","PMB 110, Biology of Fungi, University of California Berkeley, Berkeley, California, USA","USA, California, Berkeley, University of California Berkeley, Biology of Fungi, PMB 110",0
6651,2,"2012-11-30 05:27:20","2012-11-30 05:32:12",911,NULL,129375,28,"2017-04-13 18:41:04",36.9779,36.9537,-121.875,-121.836,NULL,NULL,1,"","Larkin Valley, Santa Cruz Co., California, USA","USA, California, Santa Cruz Co., Larkin Valley",0
6654,1,"2012-11-30 22:10:03","2012-11-30 22:10:03",4572,NULL,129451,18,"2018-04-18 18:47:02",37.8823,37.8612,-122.278,-122.242,NULL,NULL,1,"","University of California Mycology Lab, Berkeley, California, USA","USA, California, Berkeley, University of California Mycology Lab",0
6675,1,"2012-12-03 08:52:11","2012-12-03 08:52:11",1959,NULL,129779,22,"2018-08-19 18:06:39",37.4503,37.4488,-122.143,-122.141,NULL,NULL,1,"","Eleanor Pardee Park, Palo Alto, California, USA","USA, California, Palo Alto, Eleanor Pardee Park",0
6690,2,"2012-12-04 23:29:15","2012-12-06 20:03:45",1926,NULL,130032,101,"2018-04-16 13:23:49",37.0135,36.9674,-122.001,-121.966,NULL,NULL,1,"","Live Oak, Santa Cruz Co., California, USA","USA, California, Santa Cruz Co., Live Oak",0
6697,1,"2012-12-05 01:00:43","2012-12-05 01:00:43",1838,NULL,130077,21,"2018-04-08 21:05:35",37.8952,37.854,-122.214,-122.142,NULL,NULL,1,"","Highway 24 Corridor, Orinda, California, USA","USA, California, Orinda, Highway 24 Corridor",0
6713,1,"2012-12-07 16:46:33","2012-12-07 16:46:33",986,NULL,130381,10,"2018-04-10 02:42:32",37.9163,37.9136,-122.351,-122.348,NULL,NULL,1,"","Marina Bay Park, Richmond, California, USA","USA, California, Richmond, Marina Bay Park",0
6714,1,"2012-12-07 17:02:21","2012-12-07 17:02:21",986,NULL,130385,4,"2018-04-10 02:43:10",37.9092,37.9076,-122.352,-122.35,NULL,NULL,1,"","Vincent Park, Richmond, California, USA","USA, California, Richmond, Vincent Park",0
6718,1,"2012-12-08 00:00:28","2012-12-08 00:00:28",1838,NULL,130425,10,"2018-06-08 16:59:21",37.8386,37.8212,-122.207,-122.185,NULL,NULL,1,"","Shepard Canyon, Oakland, California, USA","USA, California, Oakland, Shepard Canyon",0
6726,1,"2012-12-09 00:15:57","2012-12-09 00:15:57",919,NULL,130587,47,"2018-04-04 20:52:32",37.8845,37.8824,-122.194,-122.191,NULL,NULL,1,"A tiny park with oak trees, Quercus agrifolia and some native plants. Beside Safeway on opposite side of Camino Pablo ","Village Grove, Orinda, California, USA","USA, California, Orinda, Village Grove",0
6727,1,"2012-12-09 00:39:55","2012-12-09 00:39:55",120,NULL,130594,16,"2017-12-29 03:12:14",37.519,37.5153,-122.007,-122.002,NULL,NULL,1,"","Ohlone College, Newark, California, USA","USA, California, Newark, Ohlone College",0
6729,1,"2012-12-09 01:41:34","2012-12-09 01:41:34",1086,NULL,130601,38,"2018-06-16 20:27:48",37.9118,37.9,-122.232,-122.21,NULL,NULL,1,"This trail runs westward from the EBMUD Orinda Connector trailhead [junction of Camino Pablo and Bear Creek Road), paralleling San Pablo Dam Road. EBMUD permits are required.","Old San Pablo Trail, Orinda, California, USA","USA, California, Orinda, Old San Pablo Trail",0
6737,1,"2012-12-09 16:14:47","2012-12-09 16:14:47",3852,NULL,130659,64,"2018-07-14 04:21:39",37.6668,37.566,-122.515,-122.443,NULL,NULL,1,"","Pacifica, California, USA","USA, California, Pacifica",0
6757,2,"2012-12-13 07:21:22","2013-11-07 21:44:30",4646,NULL,131073,143,"2018-06-13 23:45:42",37.0052,37.0024,-122.057,-122.054,NULL,NULL,1,"Redwood forest along unpaved Chinquapin Rd that starts from the firehouse of UC Santa Cruz Upper Campus","Upper Campus, University of California at Santa Cruz, Santa Cruz, California, USA","USA, California, Santa Cruz, University of California at Santa Cruz, Upper Campus",0
6780,1,"2012-12-17 05:19:24","2012-12-17 05:19:24",1926,NULL,131559,98,"2018-01-19 01:28:59",36.6892,36.6753,-121.785,-121.769,NULL,NULL,1,"","Fort Ord UC Reserve, Monterey Co., California, USA","USA, California, Monterey Co., Fort Ord UC Reserve",0
6789,1,"2012-12-19 00:49:27","2012-12-19 00:49:27",4661,NULL,131790,79,"2018-07-27 16:35:43",37.9304,37.9128,-122.032,-122,NULL,NULL,1,"","Mt. Diablo Foothills, Contra Costa County, California, USA","USA, California, Contra Costa County, Mt. Diablo Foothills",0
6830,1,"2012-12-26 20:07:42","2012-12-26 20:07:42",2812,NULL,132606,24,"2017-12-07 09:41:31",36.8684,36.749,-121.744,-121.573,NULL,NULL,1,"","Prunedale, Monterey, California, USA","USA, California, Monterey, Prunedale",0
6843,1,"2012-12-29 08:04:25","2012-12-29 08:04:25",123,NULL,132969,31,"2018-01-09 12:12:39",37.6337,37.6327,-122.476,-122.474,NULL,NULL,1,"","Church of Jesus Christ of LDS, Pacifica, California, USA","USA, California, Pacifica, Church of Jesus Christ of LDS",0
6844,1,"2012-12-29 10:40:00","2012-12-29 10:40:00",172,NULL,132980,17,"2017-12-31 16:49:29",37.9829,37.9774,-122.52,-122.508,NULL,NULL,1,"","Dominican University of California, San Rafael, California, USA","USA, California, San Rafael, Dominican University of California",0
6852,1,"2013-01-01 01:04:22","2013-01-01 01:04:22",1860,NULL,133315,32,"2017-09-07 20:25:54",37.4735,37.4435,-122.335,-122.314,NULL,NULL,1,"","Phleger Estates, Woodside, California, USA","USA, California, Woodside, Phleger Estates",0
6857,1,"2013-01-03 04:46:26","2013-01-03 04:46:26",3477,NULL,133557,73,"2018-04-21 23:32:52",37.9594,37.9102,-122.324,-122.254,360,100,1,"Public park in the East Bay Regional Parks District - eastbayparks.org","Wildcat Canyon Regional Park, Contra Costa Co., California, USA","USA, California, Contra Costa Co., Wildcat Canyon Regional Park",0
6875,2,"2013-01-09 07:03:31","2013-11-10 13:06:52",986,NULL,134124,15,"2018-03-20 17:18:09",37.9027,37.8829,-122.036,-122,NULL,NULL,1,"","Shell Ridge Open Space, Walnut Creek, California, USA","USA, California, Walnut Creek, Shell Ridge Open Space",0
6876,2,"2013-01-09 07:19:47","2013-11-10 13:06:08",986,NULL,134126,12,"2018-04-04 20:50:27",37.8977,37.8823,-122.229,-122.196,NULL,NULL,1,"","El Toyonal, Orinda, California, USA","USA, California, Orinda, El Toyonal",0
6881,1,"2013-01-10 03:58:42","2013-01-10 03:58:42",4697,NULL,134188,54,"2018-01-23 10:57:00",37.3702,37.3524,-122.234,-122.202,NULL,NULL,1,"","Coal Mine Ridge, Portola Valley, California, USA","USA, California, Portola Valley, Coal Mine Ridge",0
6893,1,"2013-01-12 06:35:10","2013-01-12 06:35:10",3795,NULL,134364,13,"2017-12-02 20:25:39",37.1678,37.1328,-121.789,-121.743,NULL,NULL,1,"","near Casa Loma Rd., Santa Clara Co., California, USA","USA, California, Santa Clara Co., near Casa Loma Rd.",0
6894,1,"2013-01-12 10:33:04","2013-01-12 10:33:04",123,NULL,134385,40,"2017-11-10 05:07:26",37.2151,37.2121,-121.838,-121.83,NULL,NULL,1,"","Singer Park, San Jose, California, USA","USA, California, San Jose, Singer Park",0
6897,2,"2013-01-12 20:44:13","2013-11-11 11:22:57",4731,NULL,134419,14,"2018-06-08 18:25:07",37.8975,37.8967,-122.258,-122.257,NULL,NULL,1,"Spiral Gardens is a non-profit community food security project located in SW Berkeley. It is open to the public Tues. - Thurs. 11-6 and Sat/Sun 11-5.","Spiral Gardens, Berkeley, California, USA","USA, California, Berkeley, Spiral Gardens",0
6898,1,"2013-01-13 00:19:32","2013-01-13 00:19:32",2785,NULL,134437,43,"2017-12-29 03:06:14",38.1735,38.0604,-122.359,-122.166,NULL,NULL,1,"","Vallejo, solano county, California, USA","USA, California, solano county, Vallejo",0
6899,1,"2013-01-13 00:48:06","2013-01-13 00:48:06",1838,NULL,134446,32,"2017-07-08 03:15:55",37.8114,37.7903,-122.141,-122.112,NULL,NULL,1,"","Upper San Leandro Reservoir, King's Canyon Loop, California, USA","USA, California, King's Canyon Loop, Upper San Leandro Reservoir",0
6901,5,"2013-01-13 05:05:33","2014-11-05 19:03:41",4733,NULL,134465,101,"2018-06-14 17:50:14",37.0118,36.9768,-122.071,-122.046,NULL,NULL,1,"Public.","UCSC, Santa Cruz, California, USA","USA, California, Santa Cruz, UCSC",0
6907,1,"2013-01-15 02:40:05","2013-01-15 02:40:05",3795,NULL,134648,24,"2018-07-25 09:03:12",37.2599,37.2572,-122.123,-122.121,NULL,NULL,1,"","near Highway 9 and Skyline Blvd., Santa Clara Co., California, USA","USA, California, Santa Clara Co., near Highway 9 and Skyline Blvd.",0
6911,1,"2013-01-16 18:09:46","2013-01-16 18:09:46",4001,NULL,134787,36,"2017-11-02 20:59:09",37.7012,37.3571,-122.543,-122.209,NULL,NULL,1,"","San Mateo Co, California, USA","USA, California, San Mateo Co",0
6916,1,"2013-01-18 18:45:54","2013-01-18 18:45:54",4557,NULL,134872,26,"2018-07-08 18:20:46",37.3942,37.3243,-122.186,-122.175,NULL,NULL,1,"","Page Mill Rd., Los Altos Hills, California, USA","USA, California, Los Altos Hills, Page Mill Rd.",0
6935,1,"2013-01-24 22:25:27","2013-01-24 22:25:27",3795,NULL,135432,8,"2017-09-12 23:28:52",36.9695,36.9649,-121.998,-121.99,10,1,1,"","Twin Lakes Park, Santa Cruz, Santa Cruz Co., California, USA","USA, California, Santa Cruz Co., Santa Cruz, Twin Lakes Park",0
6954,1,"2013-01-27 16:42:46","2013-01-27 16:42:46",4768,NULL,135817,48,"2018-06-13 22:47:40",37.0922,37.076,-122.07,-122.053,NULL,NULL,1,"","Quail Hollow Ranch County Park, Santa Cruz, California, USA","USA, California, Santa Cruz, Quail Hollow Ranch County Park",0
6964,2,"2013-01-30 00:44:42","2013-01-30 00:47:44",3795,NULL,137601,30,"2018-09-06 18:25:12",37.1324,37.0605,-121.575,-121.508,450,120,1,"","Coyote Lake-Harvey Bear County Park, Santa Clara Co., California, USA","USA, California, Santa Clara Co., Coyote Lake-Harvey Bear County Park",0
6992,1,"2013-02-03 19:42:05","2013-02-03 19:42:05",4784,NULL,143939,17,"2017-11-27 07:24:17",37.7691,37.7554,-122.444,-122.42,NULL,NULL,1,"","Castro, San Francisco, California, USA","USA, California, San Francisco, Castro",0
7016,1,"2013-02-10 23:08:15","2013-02-10 23:08:15",1838,NULL,144788,23,"2018-04-04 20:50:12",37.8835,37.8685,-122.219,-122.187,NULL,NULL,1,"","De Laveaga Trail, Orinda, California, USA","USA, California, Orinda, De Laveaga Trail",0
7148,1,"2013-03-02 00:36:58","2013-03-02 00:36:58",564,NULL,146672,21,"2018-08-28 06:39:17",37.1859,37.1475,-122.343,-122.291,NULL,NULL,1,"","Whitehouse Canyon, near Ano Nuevo State Park, Santa Cruz Co., California, USA","USA, California, Santa Cruz Co., near Ano Nuevo State Park, Whitehouse Canyon",0
7177,1,"2013-03-06 06:31:13","2013-03-06 06:31:13",986,NULL,146967,12,"2016-05-25 20:00:09",37.8948,37.8925,-122.244,-122.242,NULL,NULL,1,"","Regional Parks Botanic Garden, Contra Costa Co, California, USA","USA, California, Contra Costa Co, Regional Parks Botanic Garden",0
7178,4,"2013-03-06 06:44:47","2014-01-08 16:06:19",986,NULL,146969,64,"2018-02-07 22:23:49",38.0127,37.9887,-122.369,-122.328,NULL,NULL,1,"meadows, eucalyptus woods, bluffs and beaches
See http://www.ebparks.org/parks/pt_pinole for more information, including hours and parking fees
","Point Pinole Regional Shoreline, Richmond, California, USA","USA, California, Richmond, Point Pinole Regional Shoreline",0
7179,1,"2013-03-06 06:53:59","2013-03-06 06:53:59",986,NULL,146972,14,"2018-03-25 20:32:30",38.1376,38.1175,-122.564,-122.514,NULL,NULL,1,"","Rush Creek Open Space, Marin Co., California, USA","USA, California, Marin Co., Rush Creek Open Space",0
7186,1,"2013-03-08 09:58:53","2013-03-08 09:58:53",123,NULL,147060,41,"2018-08-07 19:18:28",37.8741,37.8737,-122.266,-122.265,NULL,NULL,1,"","BAMS meeting, UC Berkeley, Berkeley, California, USA","USA, California, Berkeley, UC Berkeley, BAMS meeting",0
7263,1,"2013-03-28 01:03:02","2013-03-28 01:03:02",4697,NULL,148379,42,"2018-08-22 04:06:25",37.3905,37.3676,-122.194,-122.169,NULL,NULL,1,"","Arastradero Preserve, Palo Alto, California, USA","USA, California, Palo Alto, Arastradero Preserve",0
7298,1,"2013-04-09 15:11:28","2013-04-09 15:11:28",1136,NULL,149135,15,"2018-01-22 04:39:12",37.4302,37.4296,-122.172,-122.171,NULL,NULL,1,"","Palm Drive, Stanford University, Stanford, California, USA","USA, California, Stanford, Stanford University, Palm Drive",0
7309,1,"2013-04-13 03:16:03","2013-04-13 03:16:03",1926,NULL,149358,8,"2018-04-16 13:25:55",36.9775,36.9613,-122.071,-122.061,NULL,NULL,1,"","Moore Creek Reserve, Santa Cruz, Santa Cruz co., California, USA","USA, California, Santa Cruz co., Santa Cruz, Moore Creek Reserve",0
7408,1,"2013-05-14 05:48:28","2013-05-14 05:48:28",181,NULL,151562,5,"2017-09-13 01:58:39",37.7373,37.7371,-122.409,-122.409,NULL,NULL,1,"","Refrigerator, Sun Spot, San Francisco, California, USA","USA, California, San Francisco, Sun Spot, Refrigerator",0
7608,1,"2013-06-16 16:03:10","2013-06-16 16:03:10",481,NULL,154900,18,"2018-01-12 04:31:50",38.359,38.339,-122.575,-122.54,700,180,1,"Founded in 1960 with 39 acres including the museum, the park now includes most of London's holdings and is a National Historic Landmark.

The park's 1400 acres include the Beauty Ranch, Cottage, House of Happy Walls Museum, Wolf House ruins, and more than 20 miles of trails. The park is located in Glen Ellen, California, about 1.5 hours north of San Francisco, in Sonoma County between the towns of Sonoma and Santa Rosa.

The property covers land on the eastern slope of Sonoma Mountain.

The park has a $10 entry fee. Mushroom collecting is not allowed without a permit.

Predominant coverage is oak, fir, grassland, some madrone.","Jack London State Historic Park, Glen Ellen, Sonoma Co., California, USA","USA, California, Sonoma Co., Glen Ellen, Jack London State Historic Park",0
7615,3,"2013-06-17 02:27:12","2015-11-17 01:04:00",5056,NULL,155024,219,"2018-09-08 01:29:17",37.8764,37.8719,-122.242,-122.235,NULL,NULL,1,"","University of California Botanical Garden at Berkeley, Berkeley, California, USA","USA, California, Berkeley, University of California Botanical Garden at Berkeley",0
7744,1,"2013-07-04 18:23:56","2013-07-04 18:23:56",911,NULL,157299,7,"2017-07-09 19:34:49",37.0815,37.068,-122.055,-122.031,NULL,NULL,1,"","Olympia Watershed, Scotts Valley, Santa Cruz, California, USA","USA, California, Santa Cruz, Scotts Valley, Olympia Watershed",0
7745,1,"2013-07-04 18:29:36","2013-07-04 18:29:36",911,NULL,157305,63,"2018-07-27 13:01:54",37.1173,37.1125,-122.267,-122.256,NULL,NULL,1,"","Last Chance Rd., Santa Cruz, California, USA","USA, California, Santa Cruz, Last Chance Rd.",0
7747,1,"2013-07-04 19:14:47","2013-07-04 19:14:47",911,NULL,157326,93,"2018-08-28 16:06:42",37.0912,37.0912,-122.138,-122.138,NULL,NULL,1,"","Alba Rd., Santa Cruz, California, USA","USA, California, Santa Cruz, Alba Rd.",0
7749,1,"2013-07-04 19:22:11","2013-07-04 19:22:11",911,NULL,157334,9,"2018-02-18 01:18:05",36.9749,36.9746,-122.034,-122.032,NULL,NULL,1,"","Locust St., Santa Cruz, California, USA","USA, California, Santa Cruz, Locust St.",0
7827,1,"2013-07-18 03:18:57","2013-07-18 03:18:57",4468,NULL,159290,169,"2018-06-27 22:52:09",38.0999,37.7186,-122.436,-121.534,NULL,NULL,1,"","Contra Costa Co., California, USA","USA, California, Contra Costa Co.",0
7834,1,"2013-07-18 04:09:06","2013-07-18 04:09:06",4468,NULL,159302,9,"2018-06-12 10:22:50",37.8103,37.7896,-122.413,-122.387,NULL,NULL,1,"","Embarcadero, San Francisco, California, USA","USA, California, San Francisco, Embarcadero",0
7836,2,"2013-07-18 04:16:50","2013-07-18 04:17:44",4468,NULL,159305,13,"2018-01-18 23:17:23",36.7323,36.6475,-121.685,-121.589,NULL,NULL,1,"ç","Salinas, California, USA","USA, California, Salinas",0
7843,1,"2013-07-18 14:30:45","2013-07-18 14:30:45",4468,NULL,159325,46,"2018-01-31 15:39:52",37.7084,37.6489,-122.5,-122.405,NULL,NULL,1,"","Daly City, California, USA","USA, California, Daly City",0
7844,1,"2013-07-18 14:31:28","2013-07-18 14:31:28",4468,NULL,159326,10,"2018-07-23 04:53:30",37.7392,37.6972,-121.989,-121.832,NULL,NULL,1,"","Dublin, California, USA","USA, California, Dublin",0
7845,2,"2013-07-18 14:31:58","2016-02-28 23:55:05",4468,NULL,159327,10,"2017-09-02 14:57:28",36.8684,36.749,-121.744,-121.573,NULL,NULL,1,"

[admin - 2016-02-28 23:55:05 +0000]: Merged with Prunedale , California , USA: North: 36.8684, South: 36.7518, West: -121.742, East: -121.573","Prunedale, California, USA","USA, California, Prunedale",0
7852,1,"2013-07-18 21:51:02","2013-07-18 21:51:02",4468,NULL,159366,14,"2018-02-04 01:40:03",37.7725,37.7453,-122.423,-122.42,NULL,NULL,1,"","Valencia St., San Francisco, California, USA","USA, California, San Francisco, Valencia St.",0
7858,1,"2013-07-18 22:06:38","2013-07-18 22:06:38",4468,NULL,159372,8,"2017-09-17 17:30:59",37.7492,37.7465,-122.426,-122.424,NULL,NULL,1,"","Cesar Chavez and Dolores St., San Francisco, California, USA","USA, California, San Francisco, Cesar Chavez and Dolores St.",0
7861,1,"2013-07-18 22:28:16","2013-07-18 22:28:16",4468,NULL,159375,6,"2016-05-13 07:41:34",37.8872,37.8845,-122.27,-122.267,NULL,NULL,1,"","Eunice and Walnut St., Berkeley, California, USA","USA, California, Berkeley, Eunice and Walnut St.",0
7863,1,"2013-07-18 22:30:54","2013-07-18 22:30:54",4468,NULL,159377,9,"2017-10-06 03:24:07",37.8721,37.8702,-122.266,-122.263,NULL,NULL,1,"","Eucalyptus Grove, University of California Berkeley, Berkeley, California, USA","USA, California, Berkeley, University of California Berkeley, Eucalyptus Grove",0
7865,1,"2013-07-18 22:33:30","2013-07-18 22:33:30",4468,NULL,159379,13,"2017-10-30 20:27:40",37.3644,37.3575,-122.135,-122.122,NULL,NULL,1,"","Foothill College, Los Altos Hills, California, USA","USA, California, Los Altos Hills, Foothill College",0
