id,version,"created_at","updated_at",user_id,description_id,rss_log_id,num_views,"last_view",north,south,west,east,high,low,ok_for_export,"notes","name","scientific_name",locked
11501,1,"2015-04-20 16:02:41","2015-04-20 16:02:41",4468,NULL,230242,11,"2018-04-16 13:40:26",36.9887,36.9883,-122.067,-122.065,NULL,NULL,1,"http://maps.ucsc.edu/content/670/map_detail","West Remote Parking Lot, University of California Santa Cruz, Santa Cruz Co., California, USA","USA, California, Santa Cruz Co., University of California Santa Cruz, West Remote Parking Lot",0
11551,1,"2015-05-04 22:02:15","2015-05-04 22:02:15",6858,NULL,231184,10,"2017-09-13 14:44:11",37.0571,36.9943,-121.805,-121.682,NULL,NULL,1,"Public access by car","Mount Madonna Center, California, USA","USA, California, Mount Madonna Center",0
11623,1,"2015-05-23 18:39:20","2015-05-23 18:39:20",7124,NULL,232629,20,"2018-08-21 18:32:11",37.3056,37.2561,-121.992,-121.922,NULL,NULL,1,"","Campbell, California, USA","USA, California, Campbell",0
12035,3,"2015-08-08 04:46:57","2018-03-20 22:34:04",5472,NULL,241255,45,"2018-08-05 03:50:14",36.6412,36.5935,-121.788,-121.691,NULL,NULL,1,"Once a military base, now a national monument with lots of trails to hike or run.

Manzanita and eucalyptus. If you think of sets on the original star trek, this is what many of the planets looked like.

[admin - 2018-03-20 22:34:04 +0000]: Merged with Fort Ord, Seaside, California, USA: North: 36.6563, South: 36.5946, West: -121.818, East: -121.732","Fort Ord National Monument, Seaside, Monterey Co., California, USA","USA, California, Monterey Co., Seaside, Fort Ord National Monument",0
12073,1,"2015-08-15 16:10:55","2015-08-15 16:10:55",1713,NULL,242065,10,"2017-09-16 03:01:19",36.9803,36.9776,-121.949,-121.947,NULL,NULL,1,"","New Brighton Middle School, Capitola, Santa Cruz Co., California, USA","USA, California, Santa Cruz Co., Capitola, New Brighton Middle School",0
12077,2,"2015-08-16 02:29:16","2015-10-20 03:15:58",5732,NULL,242102,12,"2018-01-19 01:51:36",36.7967,36.7732,-121.798,-121.79,NULL,NULL,1,"Coastal dunes. These particular lichens were found near the Potrero Road parking lot.","Salinas River State Beach, Monterey Co., California, USA","USA, California, Monterey Co., Salinas River State Beach",0
12274,1,"2015-09-17 19:51:38","2015-09-17 19:51:38",4468,NULL,245619,13,"2017-12-21 19:49:47",37.932,37.9069,-122.566,-122.547,NULL,NULL,1,"","Blithedale Canyon, Mill Valley, California, USA","USA, California, Mill Valley, Blithedale Canyon",0
12284,1,"2015-09-20 00:20:24","2015-09-20 00:20:24",4468,NULL,245856,22,"2017-09-10 00:19:49",37.8723,37.87,-122.266,-122.255,NULL,NULL,1,"","Strawberry Creek, Berkeley, California, USA","USA, California, Berkeley, Strawberry Creek",0
12337,1,"2015-09-28 19:26:08","2015-09-28 19:26:08",7676,NULL,246548,4,"2017-09-02 08:03:36",37.8698,37.8694,-122.259,-122.259,NULL,NULL,1,"","Sather Rd., Berkeley, Alameda Co, California, USA","USA, California, Alameda Co, Berkeley, Sather Rd.",0
12342,1,"2015-09-29 07:16:04","2015-09-29 07:16:04",7682,NULL,246618,10,"2017-03-07 13:06:40",37.8729,37.872,-122.252,-122.249,NULL,NULL,1,"","Tightwad Hill, Berkeley, California, USA","USA, California, Berkeley, Tightwad Hill",0
12347,1,"2015-09-29 22:59:32","2015-09-29 22:59:32",3795,NULL,246692,25,"2018-06-20 21:30:52",37.0196,37.0039,-121.717,-121.691,1900,1500,1,"","near Mount Madonna County Park, Santa Clara Co., California, USA","USA, California, Santa Clara Co., near Mount Madonna County Park",0
12358,1,"2015-10-01 03:30:44","2015-10-01 03:30:44",7642,NULL,246811,4,"2017-09-17 04:36:45",38.3209,37.8151,-123.048,-122.419,NULL,NULL,1,"","Meadow and Oak woodland near beginning of Limantour road, Marin Co., California, USA","USA, California, Marin Co., Meadow and Oak woodland near beginning of Limantour road",0
12361,2,"2015-10-01 19:41:05","2015-10-20 03:19:39",911,NULL,246842,10,"2017-09-03 19:24:04",36.9882,36.987,-122.015,-122.013,NULL,NULL,1,"","Stoney Creek Rd., Santa Cruz Co., Santa Cruz, California, USA","USA, California, Santa Cruz, Santa Cruz Co., Stoney Creek Rd.",0
12362,1,"2015-10-01 19:44:50","2015-10-01 19:44:50",911,NULL,246844,6,"2017-09-05 16:43:01",36.8707,36.853,-121.823,-121.808,NULL,NULL,1,"","Pajaro Dunes, Watsonville, Santa Cruz Co., Calfornia, USA","USA, Calfornia, Santa Cruz Co., Watsonville, Pajaro Dunes",0
12363,3,"2015-10-01 20:50:51","2016-02-28 22:50:21",911,NULL,246848,15,"2017-09-18 20:11:49",36.9525,36.9498,-122.049,-122.048,NULL,NULL,1,"","Merced Ave., Santa Cruz, Santa Cruz Co., California, USA","USA, California, Santa Cruz Co., Santa Cruz, Merced Ave.",0
12403,1,"2015-10-06 22:27:35","2015-10-06 22:27:35",768,NULL,247506,14,"2018-06-18 01:56:27",38.0999,37.7186,-122.436,-121.534,NULL,NULL,1,"","Brazil building lawn, Tilden Park, Contra Costa Co., California, USA","USA, California, Contra Costa Co., Tilden Park, Brazil building lawn",0
12404,2,"2015-10-06 22:54:15","2015-10-20 03:17:02",768,NULL,247509,13,"2018-04-10 02:44:52",37.909,37.9063,-122.289,-122.286,NULL,NULL,1,"","Sunset View Cemetery, Contra Costa Co., California, USA","USA, California, Contra Costa Co., Sunset View Cemetery",0
12413,2,"2015-10-07 19:37:13","2015-10-07 19:37:49",4468,NULL,247591,7,"2017-10-06 03:23:53",37.8701,37.869,-122.258,-122.256,NULL,NULL,1,"","Hearst Memorial Gymasium, UC Berkeley, Berkeley, California, USA","USA, California, Berkeley, UC Berkeley, Hearst Memorial Gymasium",0
12414,1,"2015-10-07 19:41:38","2015-10-07 19:41:38",4468,NULL,247592,10,"2018-06-14 06:49:18",37.8701,37.8691,-122.259,-122.258,NULL,NULL,1,"","Sproul Hall, UC Berkeley, Berkeley, California, USA","USA, California, Berkeley, UC Berkeley, Sproul Hall",0
12421,1,"2015-10-08 03:19:28","2015-10-08 03:19:28",7677,NULL,247709,36,"2018-08-28 15:03:48",37.8883,37.8856,-122.306,-122.303,NULL,NULL,1,"","800 Buchanan St. Albany, California, USA","USA, California, 800 Buchanan St. Albany",0
12422,2,"2015-10-08 05:59:37","2015-10-25 16:31:48",5427,NULL,247731,50,"2017-12-24 18:29:30",37.8665,37.8634,-122.25,-122.247,NULL,NULL,1,"Public. Go pick some yourself!

[admin - 2015-10-25 16:31:48 +0000]: Merged with Clark Kerr Campus, UC Berkeley, Berkely, California, USA: North: 37.8732, South: 37.8706, West: -122.26, East: -122.257","Clark Kerr Campus, UC Berkeley, Berkeley, California, USA","USA, California, Berkeley, UC Berkeley, Clark Kerr Campus",0
12425,2,"2015-10-09 00:06:48","2015-10-20 03:14:24",7744,NULL,247797,60,"2018-08-30 18:45:49",38.2518,38.2515,-122.388,-122.387,NULL,NULL,1,"","4755 Highway 121, Sonoma, California, USA","USA, California, Sonoma, 4755 Highway 121",0
12428,1,"2015-10-09 06:57:24","2015-10-09 06:57:24",7618,NULL,247826,12,"2018-06-20 19:19:14",37.8685,37.8594,-122.298,-122.243,NULL,NULL,1,"","Dwight Ave., Berkeley, Alameda County, California, USA","USA, California, Alameda County, Berkeley, Dwight Ave.",0
12438,1,"2015-10-10 01:35:48","2015-10-10 01:35:48",7676,NULL,247955,3,"2017-09-06 04:05:52",37.8725,37.8718,-122.265,-122.263,NULL,NULL,1,"","University Dr., Berkeley, Alameda Co, California, USA","USA, California, Alameda Co, Berkeley, University Dr.",0
12439,1,"2015-10-10 23:14:36","2015-10-10 23:14:36",7682,NULL,248031,13,"2018-04-11 06:56:51",37.8747,37.8737,-122.261,-122.26,NULL,NULL,1,"","Observatory Hill, UC Berkeley, Berkeley, California, USA","USA, California, Berkeley, UC Berkeley, Observatory Hill",0
12440,1,"2015-10-11 00:04:29","2015-10-11 00:04:29",7682,NULL,248035,15,"2017-08-30 15:32:55",37.8717,37.871,-122.263,-122.261,NULL,NULL,1,"","Valley Life Sciences Building, UC Berkeley, Berkeley, California, USA","USA, California, Berkeley, UC Berkeley, Valley Life Sciences Building",0
12456,1,"2015-10-12 05:13:32","2015-10-12 05:13:32",7716,NULL,248273,12,"2017-07-08 05:55:51",37.9057,37.8462,-122.327,-122.234,NULL,NULL,1,"","Mulford Hall Lawn, UC Berkeley Campus, Berkeley, Alameda Co., California, USA","USA, California, Alameda Co., Berkeley, UC Berkeley Campus, Mulford Hall Lawn",0
12458,2,"2015-10-12 09:01:09","2015-10-20 03:08:44",7779,NULL,248289,19,"2017-09-07 09:31:13",37.9057,37.8462,-122.327,-122.234,NULL,NULL,1,"","beginning of Firetrails, northeast of campus near Memorial Stadium, Berkeley, Alameda Co., California, USA","USA, California, Alameda Co., Berkeley, northeast of campus near Memorial Stadium, beginning of Firetrails",0
12459,1,"2015-10-12 14:05:10","2015-10-12 14:05:10",181,NULL,248305,10,"2017-09-06 03:48:47",37.9057,37.8462,-122.327,-122.234,NULL,NULL,1,"","Lower Sproul Hall, UC Berkeley, Berkeley, California, USA","USA, California, Berkeley, UC Berkeley, Lower Sproul Hall",0
12493,1,"2015-10-17 00:26:10","2015-10-17 00:26:10",7781,NULL,249171,11,"2018-06-14 06:50:17",37.64,37.6373,-122.113,-122.11,NULL,NULL,1,"","Mount Eden Cemetery, Hayward, California, USA","USA, California, Hayward, Mount Eden Cemetery",0
12494,1,"2015-10-17 17:39:14","2015-10-17 17:39:14",7642,NULL,249234,15,"2018-06-13 21:35:45",37.9057,37.8462,-122.327,-122.234,NULL,NULL,1,"","Lawn behind East Asian Library, UC Berkeley Campus, Berkeley, Alameda Co., California, USA","USA, California, Alameda Co., Berkeley, UC Berkeley Campus, Lawn behind East Asian Library",0
12498,1,"2015-10-17 22:34:41","2015-10-17 22:34:41",7041,NULL,249296,17,"2018-01-19 01:45:11",36.8228,36.8075,-121.796,-121.788,NULL,NULL,1,"State Beach so normal state beach rules apply, much of the area is in restoration and you cannot go in it.","Moss Landing State Beach, Monterey Co., California, USA","USA, California, Monterey Co., Moss Landing State Beach",0
12501,1,"2015-10-18 04:18:12","2015-10-18 04:18:12",7784,NULL,249338,7,"2018-01-06 21:31:00",36.5643,36.541,-121.932,-121.913,NULL,NULL,1,"","Hastings National History Reserve, Carmel Valley, Carmel, Monterey Co., California, USA","USA, California, Monterey Co., Carmel, Carmel Valley, Hastings National History Reserve",0
12502,1,"2015-10-18 04:27:45","2015-10-18 04:27:45",7784,NULL,249345,34,"2018-04-12 04:48:12",38.0999,37.7186,-122.436,-121.534,NULL,NULL,1,"","Lake Anza Trail in Tilden Regional Park, Berkeley, Contra Costa Co., California, USA","USA, California, Contra Costa Co., Berkeley, Lake Anza Trail in Tilden Regional Park",0
12509,1,"2015-10-18 14:51:33","2015-10-18 14:51:33",4468,NULL,249401,64,"2018-08-28 15:22:17",37.8646,37.8619,-122.257,-122.255,NULL,NULL,1,"","2603 Hillegass, Berkeley, Alameda Co., California, USA","USA, California, Alameda Co., Berkeley, 2603 Hillegass",0
12514,1,"2015-10-19 07:41:47","2015-10-19 07:41:47",7822,NULL,249529,7,"2017-08-31 14:08:05",37.8771,37.8744,-122.259,-122.256,NULL,NULL,1,"","Goldman School of Public Policy, Berkeley, California, USA","USA, California, Berkeley, Goldman School of Public Policy",0
12516,1,"2015-10-19 19:07:14","2015-10-19 19:07:14",123,NULL,249570,74,"2018-08-28 15:53:33",37.8641,37.8625,-122.25,-122.248,NULL,NULL,1,"","2601 Warring St., Berkeley, California, USA","USA, California, Berkeley, 2601 Warring St.",0
12518,1,"2015-10-19 23:45:15","2015-10-19 23:45:15",7716,NULL,249627,16,"2018-03-25 02:07:51",37.8723,37.8696,-122.27,-122.267,NULL,NULL,1,"","UC Berkeley Campus, Berkeley, Alameda Co, California, USA","USA, California, Alameda Co, Berkeley, UC Berkeley Campus",0
12522,1,"2015-10-20 03:11:15","2015-10-20 03:11:15",4468,NULL,249663,10,"2018-04-10 02:44:36",37.9105,37.9067,-122.305,-122.302,NULL,NULL,1,"","under BART, El Cerrito BART Station, El Cerrito, Alameda Co., California, USA","USA, California, Alameda Co., El Cerrito, El Cerrito BART Station, under BART",0
12581,2,"2015-10-27 19:04:51","2015-10-28 00:29:41",7681,NULL,250714,20,"2018-01-28 04:50:20",37.485,37.4618,-122.363,-122.337,NULL,NULL,1,"","Skyline Blvd., Redwood City, California, USA","USA, California, Redwood City, Skyline Blvd.",0
12590,1,"2015-10-28 00:52:49","2015-10-28 00:52:49",5485,NULL,250803,26,"2018-02-18 16:06:53",37.8742,37.8735,-122.266,-122.265,NULL,NULL,1,"","Barker Hall, UC Berkeley, Berkeley, Alameda Co., California, USA","USA, California, Alameda Co., Berkeley, UC Berkeley, Barker Hall",0
12595,2,"2015-10-28 15:06:56","2015-12-18 03:20:56",7618,NULL,250863,13,"2017-09-07 02:14:52",37.8703,37.8692,-122.252,-122.251,NULL,NULL,1,"","International House, UC Berkeley, Berkeley, Alameda Co, California, USA","USA, California, Alameda Co, Berkeley, UC Berkeley, International House",0
12648,1,"2015-11-05 17:30:19","2015-11-05 17:30:19",7681,NULL,251926,26,"2018-02-02 06:16:30",37.9057,37.8462,-122.327,-122.234,NULL,NULL,1,"","Barrows Hall, UC Berkeley campus, Berkeley, California, USA","USA, California, Berkeley, UC Berkeley campus, Barrows Hall",0
12669,2,"2015-11-09 21:06:57","2015-12-12 04:01:50",7676,NULL,252474,18,"2017-07-08 22:08:08",37.8729,37.8715,-122.264,-122.261,NULL,NULL,1,"","lawn behind VLSB, UC Berkeley, Berkeley, Alameda Co., California, USA","USA, California, Alameda Co., Berkeley, UC Berkeley, lawn behind VLSB",0
12670,1,"2015-11-09 21:13:22","2015-11-09 21:13:22",7682,NULL,252477,4,"2017-07-05 16:45:52",37.8754,37.8746,-122.255,-122.252,NULL,NULL,1,"","Cyclotron Rd., Berkeley, California, USA","USA, California, Berkeley, Cyclotron Rd.",0
12673,1,"2015-11-10 00:15:45","2015-11-10 00:15:45",7681,NULL,252532,20,"2018-05-09 07:05:42",36.5275,36.5248,-121.868,-121.866,NULL,NULL,1,"","Santa Lucia Preserve, Carmel, California, USA","USA, California, Carmel, Santa Lucia Preserve",0
12697,1,"2015-11-14 21:43:47","2015-11-14 21:43:47",7674,NULL,253111,345,"2018-09-05 04:36:10",37.8814,37.8814,-122.249,-122.249,NULL,NULL,1,"","1597 Olympus Ave., Berkeley, Alameda Co, California, USA","USA, California, Alameda Co, Berkeley, 1597 Olympus Ave.",0
12714,2,"2015-11-18 20:46:15","2015-12-12 03:59:35",7618,NULL,253533,16,"2017-02-06 10:19:22",37.8722,37.8708,-122.264,-122.261,NULL,NULL,1,"","VLSB, UC Berkeley, Berkeley, Alameda Co., California, USA","USA, California, Alameda Co., Berkeley, UC Berkeley, VLSB",0
12725,1,"2015-11-22 02:18:21","2015-11-22 02:18:21",911,NULL,253809,32,"2018-06-02 16:33:54",36.9701,36.9691,-122.047,-122.046,NULL,NULL,1,"","Intersection of Bay St. and Escalona Ave., Santa Cruz, Santa Cruz Co., California, USA","USA, California, Santa Cruz Co., Santa Cruz, Intersection of Bay St. and Escalona Ave.",0
12726,1,"2015-11-22 03:08:56","2015-11-22 03:08:56",911,NULL,253815,23,"2018-04-15 06:13:34",37.0192,37.0148,-122.047,-122.034,NULL,NULL,1,"","Powder Mill Trail, Henry Cowell Redwoods State Park, Santa Cruz Co., California, USA","USA, California, Santa Cruz Co., Henry Cowell Redwoods State Park, Powder Mill Trail",0
12734,1,"2015-11-24 21:52:16","2015-11-24 21:52:16",911,NULL,254100,40,"2018-04-22 11:12:13",37.0199,37.0004,-122.08,-122.052,NULL,NULL,1,"","Upper Campus, University of California at Santa Cruz, Santa Cruz Co., California, USA","USA, California, Santa Cruz Co., University of California at Santa Cruz, Upper Campus",0
12738,1,"2015-11-26 22:00:21","2015-11-26 22:00:21",5549,NULL,254177,4,"2018-01-24 01:31:43",36.9999,36.9972,-122.064,-122.062,NULL,NULL,1,"","Science Hill, University of California Santa Cruz, California, USA","USA, California, University of California Santa Cruz, Science Hill",0
12746,3,"2015-11-28 00:09:13","2015-12-03 18:30:13",7041,NULL,254265,21,"2017-09-02 09:13:42",37.405,37.3959,-121.941,-121.919,NULL,NULL,1,"","River Oaks Parkway, San Jose, California, USA","USA, California, San Jose, River Oaks Parkway",0
12749,1,"2015-11-29 07:38:46","2015-11-29 07:38:46",911,NULL,254367,9,"2018-06-13 20:20:49",36.9221,36.9195,-121.773,-121.768,NULL,NULL,1,"","Cesar Chavez Middle School, Watsonville, Santa Cruz Co., California, USA","USA, California, Santa Cruz Co., Watsonville, Cesar Chavez Middle School",0
12753,2,"2015-11-29 18:26:46","2015-11-29 18:27:35",7041,NULL,254419,8,"2018-06-13 23:42:20",37.2162,37.2079,-122.16,-122.152,NULL,NULL,1,"","Waterman Gap, Boulder Creek, California, USA","USA, California, Boulder Creek, Waterman Gap",0
12755,1,"2015-11-29 22:48:26","2015-11-29 22:48:26",8084,NULL,254457,5,"2015-11-30 08:19:24",37.2044,37.2041,-121.864,-121.863,NULL,NULL,1,"Private lawn under the canopy of two oak trees. ","Webb Canyon Drive, San Jose, Santa Clara Co., California, USA","USA, California, Santa Clara Co., San Jose, Webb Canyon Drive",0
12757,1,"2015-11-29 23:27:57","2015-11-29 23:27:57",8084,NULL,254463,35,"2018-08-28 15:04:50",37.2434,37.2373,-121.875,-121.868,NULL,NULL,1,"","Almaden Lake Trial, San Jose, Santa Clara Co., California, USA","USA, California, Santa Clara Co., San Jose, Almaden Lake Trial",0
12759,1,"2015-11-30 19:26:01","2015-11-30 19:26:01",7720,NULL,254490,96,"2018-08-28 16:16:11",37.8684,37.8657,-122.252,-122.249,113,113,1,"","2425 warring st, berkeley, California, USA","USA, California, berkeley, 2425 warring st",0
12760,1,"2015-11-30 19:43:01","2015-11-30 19:43:01",941,NULL,254493,4,"2017-09-01 13:40:39",37.1262,37.0963,-122.061,-122.04,NULL,NULL,1,"","Lompico, California, USA","USA, California, Lompico",0
12771,1,"2015-12-02 05:03:05","2015-12-02 05:03:05",8088,NULL,254605,4,"2017-05-08 07:42:47",37.9057,37.8462,-122.327,-122.234,NULL,NULL,1,"","Mulford Hall, UC Berkeley Campus, Berkeley, California, USA","USA, California, Berkeley, UC Berkeley Campus, Mulford Hall",0
12778,1,"2015-12-04 19:46:22","2015-12-04 19:46:22",4468,NULL,254710,111,"2018-06-29 22:10:29",37.8571,37.8544,-122.258,-122.256,NULL,NULL,1,"","2450 Ashby Ave., Berkeley, California, USA","USA, California, Berkeley, 2450 Ashby Ave.",0
12795,2,"2015-12-07 20:30:10","2015-12-08 01:44:10",7361,NULL,255105,12,"2017-09-03 10:18:38",37.8817,37.8716,-122.282,-122.28,NULL,NULL,1,"","Giannini Hall, UC Berkeley, Berkeley, California, USA","USA, California, Berkeley, UC Berkeley, Giannini Hall",0
12796,1,"2015-12-08 02:47:18","2015-12-08 02:47:18",7716,NULL,255133,19,"2018-09-02 02:34:15",37.9057,37.8462,-122.327,-122.234,NULL,NULL,1,"","Lewis Hall, UC Berkeley campus, Berkeley, California, USA","USA, California, Berkeley, UC Berkeley campus, Lewis Hall",0
12797,2,"2015-12-08 04:43:13","2015-12-12 03:14:10",8131,NULL,255142,48,"2018-08-28 16:16:31",37.8987,37.8899,-122.307,-122.303,NULL,NULL,1,"","Albany Hill Park, Albany, California, USA","USA, California, Albany, Albany Hill Park",0
12798,1,"2015-12-08 05:03:30","2015-12-08 05:03:30",7716,NULL,255147,7,"2017-09-07 01:02:18",37.9057,37.8462,-122.327,-122.234,NULL,NULL,1,"","Hass, UC Berkeley campus, Berkeley, California, USA","USA, California, Berkeley, UC Berkeley campus, Hass",0
12799,1,"2015-12-08 18:13:16","2015-12-08 18:13:16",911,NULL,255177,56,"2018-09-05 11:57:52",37.1137,37.0939,-122.268,-122.262,NULL,NULL,1,"","Last Chance Rd., Santa Cruz, Santa Cruz Co., California, USA","USA, California, Santa Cruz Co., Santa Cruz, Last Chance Rd.",0
12807,2,"2015-12-11 05:17:05","2015-12-11 06:16:54",7041,NULL,255448,23,"2018-01-24 19:29:51",37.3243,37.3242,-122.204,-122.204,NULL,NULL,1,"","Vista Parking Lot, Skyline Blvd., Redwood City, San Mateo Co., California, USA","USA, California, San Mateo Co., Redwood City, Skyline Blvd., Vista Parking Lot",0
12837,1,"2015-12-15 02:41:55","2015-12-15 02:41:55",911,NULL,255811,82,"2018-08-25 03:12:56",37.0804,36.9881,-121.933,-121.829,NULL,NULL,1,"","Forest of Nisene Marks State Park, Aptos, Santa Cruz Co., California, USA","USA, California, Santa Cruz Co., Aptos, Forest of Nisene Marks State Park",0
12840,1,"2015-12-15 17:58:02","2015-12-15 17:58:02",911,NULL,255874,9,"2018-04-02 08:17:03",36.9648,36.9493,-122.057,-122.024,NULL,NULL,1,"","Westcliff Drive, Santa Cruz, Santa Cruz Co., California, USA","USA, California, Santa Cruz Co., Santa Cruz, Westcliff Drive",0
12845,1,"2015-12-16 01:26:31","2015-12-16 01:26:31",354,NULL,255924,14,"2018-04-10 02:45:30",37.9382,37.8978,-122.324,-122.281,NULL,NULL,1,"","El Cerrito, California, USA","USA, California, El Cerrito",0
12849,1,"2015-12-16 02:05:40","2015-12-16 02:05:40",4468,NULL,255930,32,"2018-07-09 04:29:01",37.0505,37.0327,-122.167,-122.135,NULL,NULL,1,"","Bonny Doon, Santa Cruz Co., California, USA","USA, California, Santa Cruz Co., Bonny Doon",0
12850,1,"2015-12-16 02:07:39","2015-12-16 02:07:39",4468,NULL,255931,12,"2018-03-26 16:30:34",37.7193,37.7166,-121.904,-121.901,NULL,NULL,1,"","Camp Parks, Dublin, California, USA","USA, California, Dublin, Camp Parks",0
12854,1,"2015-12-16 02:34:37","2015-12-16 02:34:37",4468,NULL,255935,15,"2017-07-06 06:23:07",37.4967,37.3866,-122.369,-122.265,NULL,NULL,1,"","near Skyline Boulevard vista parking lot, Redwood City, California, USA","USA, California, Redwood City, near Skyline Boulevard vista parking lot",0
12856,1,"2015-12-16 06:41:49","2015-12-16 06:41:49",1959,NULL,255953,20,"2017-10-30 20:13:23",37.3229,37.3221,-122.048,-122.046,NULL,NULL,1,"","De Anza College, Cupertino, California, USA","USA, California, Cupertino, De Anza College",0
12861,1,"2015-12-18 02:17:50","2015-12-18 02:17:50",4468,NULL,256112,5,"2017-07-10 04:58:35",37.8703,37.8692,-122.256,-122.255,NULL,NULL,1,"","Lawn by Kroeber Hall, UC Berkeley Campus, Berkeley, Alameda Co., California, USA","USA, California, Alameda Co., Berkeley, UC Berkeley Campus, Lawn by Kroeber Hall",0
12862,5,"2015-12-18 02:21:44","2015-12-18 02:51:30",4468,NULL,256113,18,"2018-01-10 18:25:43",37.8737,37.8729,-122.264,-122.264,NULL,NULL,1,"","in front of Morgan Hall, UC Berkeley Campus, Berkeley, Alameda Co., California, USA","USA, California, Alameda Co., Berkeley, UC Berkeley Campus, in front of Morgan Hall",0
12864,1,"2015-12-18 03:24:10","2015-12-18 03:24:10",4468,NULL,256118,10,"2017-09-17 17:30:17",37.8748,37.8687,-122.245,-122.228,NULL,NULL,1,"","Upper Fire Trail, Berkeley, Alameda Co., California, USA","USA, California, Alameda Co., Berkeley, Upper Fire Trail",0
12868,1,"2015-12-19 03:24:02","2015-12-19 03:24:02",7041,NULL,256170,9,"2018-06-06 14:17:23",37.3991,37.3729,-122.256,-122.244,NULL,NULL,1,"","Old La Honda Rd., Woodside, San Mateo Co, California, USA","USA, California, San Mateo Co, Woodside, Old La Honda Rd.",0
12869,1,"2015-12-19 04:38:08","2015-12-19 04:38:08",768,NULL,256180,30,"2018-07-09 20:01:51",38.2519,37.746,-123.071,-122.442,NULL,NULL,1,"","Five brooks trailhead, Pt Reyes, National Seashore, Marin Co. California, USA","USA, Marin Co. California, National Seashore, Pt Reyes, Five brooks trailhead",0
12871,1,"2015-12-19 05:48:22","2015-12-19 05:48:22",7041,NULL,256185,59,"2018-05-11 18:22:45",37.4285,37.4123,-122.239,-122.19,NULL,NULL,1,"","Sand Hill Rd., Menlo Park, San Mateo Co, California, USA","USA, California, San Mateo Co, Menlo Park, Sand Hill Rd.",0
12875,1,"2015-12-22 02:22:24","2015-12-22 02:22:24",8084,NULL,256374,10,"2018-05-26 20:18:39",37.2235,37.2117,-121.85,-121.839,NULL,NULL,1,"","Leland High School, San Jose, California, USA","USA, California, San Jose, Leland High School",0
12877,1,"2015-12-23 00:37:43","2015-12-23 00:37:43",911,NULL,256467,12,"2018-04-15 07:44:20",36.9922,36.9896,-122.066,-122.064,NULL,NULL,1,"","College 8, University of California Santa Cruz, Santa Cruz Co., California, USA","USA, California, Santa Cruz Co., University of California Santa Cruz, College 8",0
12881,1,"2015-12-23 05:32:33","2015-12-23 05:32:33",911,NULL,256490,20,"2018-04-17 20:59:06",37.0013,36.9986,-122.064,-122.061,NULL,NULL,1,"","Science Hill, University of California Santa Cruz, Santa Cruz Co., California, USA","USA, California, Santa Cruz Co., University of California Santa Cruz, Science Hill",0
12883,1,"2015-12-23 17:44:44","2015-12-23 17:44:44",911,NULL,256523,7,"2018-04-16 13:27:59",36.9955,36.9929,-122.067,-122.064,NULL,NULL,1,"","Porter College, University of California Santa Cruz, Santa Cruz Co., California, USA","USA, California, Santa Cruz Co., University of California Santa Cruz, Porter College",0
12885,2,"2015-12-23 23:26:00","2015-12-27 17:59:32",911,NULL,256565,24,"2018-06-14 01:33:57",36.9546,36.9521,-122.033,-122.025,NULL,NULL,1,"

[admin - 2015-12-27 17:59:32 +0000]: Merged with Lighthouse Field, Santa Cruz, California, USA: North: 36.9622, South: 36.9444, West: -122.045, East: -122.013","Lighthouse Field State Beach, Santa Cruz Co., California, USA","USA, California, Santa Cruz Co., Lighthouse Field State Beach",0
12895,1,"2015-12-25 16:08:20","2015-12-25 16:08:20",911,NULL,256675,113,"2018-08-26 04:25:39",37.0975,37.0518,-122.137,-122.082,NULL,NULL,1,"","Fall Creek Unit, Henry Cowell Redwoods State Park, Santa Cruz Co., California, USA","USA, California, Santa Cruz Co., Henry Cowell Redwoods State Park, Fall Creek Unit",0
12898,1,"2015-12-26 02:12:52","2015-12-26 02:12:52",8204,NULL,256744,10,"2018-08-13 04:40:59",37.2075,37.1262,-121.707,-121.593,NULL,NULL,1,"","Morgan Hill, California, USA","USA, California, Morgan Hill",0
12900,1,"2015-12-26 15:51:04","2015-12-26 15:51:04",911,NULL,256810,22,"2018-04-16 13:18:35",37.1645,37.1454,-122.198,-122.186,NULL,NULL,1,"","Eagle Rock Trail, Big Basin State Park, Santa Cruz Co., California, USA","USA, California, Santa Cruz Co., Big Basin State Park, Eagle Rock Trail",0
12906,1,"2015-12-27 05:33:07","2015-12-27 05:33:07",2304,NULL,256878,34,"2018-07-04 04:56:59",37.9424,37.9316,-122.557,-122.54,NULL,NULL,1,"","King Mountain Open Space Preserve, Larkspur, Marin County, California, USA","USA, California, Marin County, Larkspur, King Mountain Open Space Preserve",0
12914,1,"2015-12-28 23:51:10","2015-12-28 23:51:10",911,NULL,257053,7,"2017-07-09 09:06:59",36.9577,36.9549,-122.027,-122.026,NULL,NULL,1,"","Gateway School, Santa Cruz, Santa Cruz Co., California, USA","USA, California, Santa Cruz Co., Santa Cruz, Gateway School",0
12917,1,"2015-12-29 15:24:35","2015-12-29 15:24:35",4468,NULL,257102,39,"2018-08-28 15:08:12",36.996,36.9736,-122.002,-121.983,NULL,NULL,1,"","Arana Gulch, Santa Cruz, Santa Cruz Co., California, USA","USA, California, Santa Cruz Co., Santa Cruz, Arana Gulch",0
